{
  "protocol_version": "0.1",
  "run_id": "example-run-001",
  "delivery_status": "review_ready",
  "project": {
    "source_locale": "en-US",
    "target_locales": ["zh-CN"],
    "mode": "standard_project",
    "operating_mode": "greenfield_localization",
    "reference_policy": "style_only"
  },
  "source_material": [
    {
      "path": "locales/en-US.json",
      "role": "source_of_truth"
    }
  ],
  "outputs": [
    {
      "package_path": "files/locales/zh-CN.json",
      "destination": "locales/zh-CN.json",
      "sha256": "aaaaaaaaaaaaaaaaaaaaaaaaaaaaaaaaaaaaaaaaaaaaaaaaaaaaaaaaaaaaaaaa"
    }
  ],
  "assets": {
    "context": "localization-context.md",
    "localization_brief": "localization-brief.json",
    "localization_brief_yaml": "localization-brief.yaml",
    "glossary": "glossary.csv",
    "translation_memory": "translation-memory.jsonl",
    "term_registry": "term-registry.csv",
    "forbidden_translations": "forbidden-translations.csv",
    "term_decisions": "term-decisions.jsonl",
    "term_conflicts": "term-conflicts.jsonl",
    "term_provenance": "term-provenance.jsonl",
    "candidate_terms": "candidate-terms.jsonl",
    "termbase_preflight_report": "termbase-preflight-report.json",
    "term_review_queue": "term-review-queue.json",
    "term_review_decisions": "term-review-decisions.jsonl",
    "generation_strategy": "generation-strategy.json",
    "generation_handoff_decision": "generation-handoff-decision.json",
    "artifact_state": "artifact-state.json",
    "blocking_questions": "blocking-questions.json",
    "resolution_options": "resolution-options.json",
    "user_resolution_decisions": "user-resolution-decisions.jsonl",
    "resolution_summary": "resolution-summary.md",
    "qa_report": "qa-report.md"
  },
  "qa": {
    "status": "pass",
    "blocking_count": 0,
    "warning_count": 0,
    "report": "qa-report.md"
  },
  "runtime": {
    "name": "localize-anything-reference",
    "version": "0.1.0"
  }
}
